{
  "schema": "negura.register-evidence/v1",
  "source": "ouro",
  "sourceEventId": "EVT-000007",
  "evidence": {
    "title": "Pinned Ouro Run completed",
    "observation": "The procedure passed every run-specific Gate.",
    "observedAt": "2026-07-14T00:00:00.000Z",
    "generatedBy": {
      "system": "ouro",
      "type": "run",
      "id": "RUN-0001",
      "version": "1"
    },
    "derivedFrom": [
      {
        "system": "negura",
        "type": "context_bundle",
        "id": "CTX-EXAMPLE",
        "version": "1",
        "digest": "sha256:1111111111111111111111111111111111111111111111111111111111111111"
      }
    ]
  }
}
